{
  "authority": {
    "common_purpose_findings_allowed": false,
    "complete_compact_findings_allowed": false,
    "coordination_findings_allowed": false,
    "graph_effects_allowed": false,
    "prevalence_findings_allowed": false,
    "publication_effects_allowed": false,
    "racial_order_findings_allowed": false,
    "reviewed_disposition_changes_allowed": false
  },
  "decisive_join": "Separate representational membership and advisory participation from binding policy, award, budget, implementation, and affected-party remedy authority.",
  "findings": [
    {
      "claim": "Representational membership is not equivalent to binding institutional authority.",
      "id": "rd05-f1",
      "limits": [
        "The comparison does not determine whether ACES membership was neutral, tokenistic, or practically influential"
      ],
      "source_ids": [
        "aces-home",
        "aces-first-meeting",
        "nsb-home",
        "nsb-awards-charge"
      ],
      "status": "supported"
    },
    {
      "claim": "The National Science Board is a matched representation-explicit control with binding policy and award authority absent from the recovered ACES remit.",
      "id": "rd05-f2",
      "limits": [
        "Binding institutional authority remains distinct from affected-party counterpower"
      ],
      "source_ids": [
        "nsb-home",
        "nsb-composition",
        "nsb-awards-charge",
        "aces-home"
      ],
      "status": "supported"
    },
    {
      "claim": "The official ACES record does not establish completed, adopted, rejected, or implemented recommendations.",
      "id": "rd05-f3",
      "limits": [
        "The second meeting was canceled and no terminal disposition record was recovered"
      ],
      "source_ids": [
        "aces-first-meeting",
        "aces-meetings",
        "aces-home"
      ],
      "status": "blocked"
    }
  ],
  "lane_id": "RD-05",
  "observations": [
    {
      "field": "institutional_chronology",
      "id": "rd05-o1",
      "notes": "The available official chronology shows approval of subcommittee topics and ends before the canceled second meeting could create a terminal public recommendation record.",
      "source_ids": [
        "aces-home",
        "aces-first-meeting",
        "aces-meetings"
      ],
      "state": "observed",
      "subject": "ACES",
      "value": {
        "inaugural_roster": 17,
        "planned_second_meeting": "canceled",
        "public_meetings_held": 1,
        "public_nomination_route": true,
        "subcommittee_topics_approved": true,
        "termination_effective": "2025-02-28"
      }
    },
    {
      "field": "completed_recommendations_and_dispositions",
      "id": "rd05-o2",
      "notes": "Zero means zero recovered records in the bounded source set, not proof that no informal work occurred.",
      "source_ids": [
        "aces-home",
        "aces-first-meeting",
        "aces-meetings"
      ],
      "state": "unrecovered",
      "subject": "ACES",
      "value": {
        "agency_responses": 0,
        "completed_recommendations": 0,
        "implementation_records": 0
      }
    },
    {
      "field": "binding_authority_classes",
      "id": "rd05-o3",
      "notes": "The official description provides advice and recommendations; it does not assign binding policy, major-award, or budget-vote authority.",
      "source_ids": [
        "aces-home"
      ],
      "state": "not_observed",
      "subject": "ACES",
      "value": []
    },
    {
      "field": "binding_authority_classes",
      "id": "rd05-o4",
      "notes": "The matched control combines representation-explicit membership with source-addressable institutional authority.",
      "source_ids": [
        "nsb-home",
        "nsb-awards-charge"
      ],
      "state": "observed",
      "subject": "National Science Board",
      "value": [
        "NSF policy",
        "major awards",
        "facilities and budget-related approvals"
      ]
    },
    {
      "field": "affected_party_remedy",
      "id": "rd05-o5",
      "notes": "Neither recovered institutional description establishes a remedy controlled by affected external parties.",
      "source_ids": [
        "aces-home",
        "nsb-home",
        "nsb-awards-charge"
      ],
      "state": "unrecovered",
      "subject": "ACES and National Science Board",
      "value": null
    }
  ],
  "schema_version": 1,
  "selection_rule": "Use a representation-explicit federal-governance control with source-addressable binding authority; do not infer identity attributes or choose a control merely because it confirms the thesis.",
  "sources": [
    {
      "accessed": "2026-08-01",
      "id": "aces-home",
      "kind": "official",
      "limits": [
        "Advisory remit is not binding policy, award, or budget authority"
      ],
      "published": null,
      "publisher": "Office of Space Commerce",
      "supports": [
        "Advisory function",
        "Initial 17-member roster",
        "Termination effective 2025-02-28"
      ],
      "title": "Advisory Committee on Excellence in Space (ACES)",
      "url": "https://space.commerce.gov/advisory-committee-on-excellence-in-space-aces/"
    },
    {
      "accessed": "2026-08-01",
      "id": "aces-first-meeting",
      "kind": "official",
      "limits": [
        "Agenda does not establish that recommendations were completed or adopted"
      ],
      "published": "2024-10-25",
      "publisher": "Office of Space Commerce",
      "supports": [
        "Public meeting",
        "Subcommittee workstreams",
        "Agenda item to finalize recommendations"
      ],
      "title": "First ACES public meeting",
      "url": "https://space.commerce.gov/first-aces-public-meeting-set-for-october-3/"
    },
    {
      "accessed": "2026-08-01",
      "id": "aces-meetings",
      "kind": "official",
      "limits": [
        "Cancellation leaves subcommittee reports and final recommendations unrecovered"
      ],
      "published": null,
      "publisher": "Office of Space Commerce",
      "supports": [
        "First meeting held",
        "Second meeting canceled"
      ],
      "title": "ACES meetings and materials",
      "url": "https://space.commerce.gov/advisory-committee-on-excellence-in-space-aces/aces-meetings/"
    },
    {
      "accessed": "2026-08-01",
      "id": "nsb-home",
      "kind": "official",
      "limits": [
        "Institutional authority is not affected-party counterpower"
      ],
      "published": null,
      "publisher": "National Science Board",
      "supports": [
        "NSB policy-setting and award-approval roles"
      ],
      "title": "About the National Science Board",
      "url": "https://www.nsf.gov/nsb"
    },
    {
      "accessed": "2026-08-01",
      "id": "nsb-composition",
      "kind": "official",
      "limits": [
        "Formal representation criteria do not prove practical influence for every member"
      ],
      "published": null,
      "publisher": "U.S. Code / National Science Foundation",
      "supports": [
        "Representation-explicit membership criteria and public roster"
      ],
      "title": "NSB Nomination and Appointment Process",
      "url": "https://www.nsf.gov/nsb/members/nominations"
    },
    {
      "accessed": "2026-08-01",
      "id": "nsb-awards-charge",
      "kind": "official",
      "limits": [
        "Committee authority does not establish remedy rights for affected nonmembers"
      ],
      "published": null,
      "publisher": "National Science Board",
      "supports": [
        "Source-addressable major-award and facilities authority"
      ],
      "title": "NSB Committees and Committee on Awards and Facilities charge",
      "url": "https://www.nsf.gov/nsb/committees"
    }
  ],
  "terminal_receipt": {
    "closed_residual_classes": [],
    "open_residual_classes": [
      "completed_recommendations",
      "agency_dispositions",
      "implementation",
      "practical_member_influence",
      "affected_party_remedy"
    ],
    "prohibited_inferences": [
      "representation proves neutrality",
      "representation proves tokenism",
      "formal membership proves practical authority",
      "binding institutional authority equals affected-party counterpower",
      "canceled meeting proves no informal work occurred"
    ],
    "state": "ordinary_advisory_representation_control_strengthened_binding_governance_control_identified"
  },
  "title": "ACES representation versus binding institutional authority",
  "wave_id": "RD-W01"
}
